{
  "corpus_manifest": {
    "path": "fixtures/m7/m7-corpus-manifest.v1.json",
    "sha256": "45f8e9b894b8f36a95ff20a0633e39c665d9b273a3025c8b3ff836e7a71d2fef"
  },
  "frozen_on": "2026-08-22",
  "queries": [
    {
      "annotation_scope": "whole_graph",
      "backward_chain_depth": 4,
      "candidate_id": "M7-C01",
      "criterion_node_id": "/Game/Probe/BP_SlicingProbe.BP_SlicingProbe:EventGraph::node::4dfa7c52-4c68-5126-fd8b-8ea83dbf590e",
      "description": "Rule-selected execution criterion: the node with the longest backward supported-execution chain.",
      "graph_id": "/Game/Probe/BP_SlicingProbe.BP_SlicingProbe:EventGraph",
      "query_id": "M7-Q-S-C01-EXEC",
      "risk_dimensions": [
        "source_traceability_and_progressive_disclosure"
      ],
      "slice_kind": "execution"
    },
    {
      "annotation_scope": "whole_graph",
      "candidate_id": "M7-C01",
      "description": "Rule-selected data member: the member GUID with the most Set nodes.",
      "graph_id": "/Game/Probe/BP_SlicingProbe.BP_SlicingProbe:EventGraph",
      "member_guid": "0fdf8c87-4cc0-0093-a246-d2a760d4d912",
      "member_name": "Health",
      "query_id": "M7-Q-S-C01-DATA",
      "risk_dimensions": [
        "source_traceability_and_progressive_disclosure"
      ],
      "slice_kind": "data"
    },
    {
      "annotation_scope": "whole_graph",
      "backward_chain_depth": 5,
      "candidate_id": "M7-C02",
      "criterion_node_id": "/Game/LensCorpus/BP_LensCorpus_Main.BP_LensCorpus_Main:EvaluateEncounter::node::d121002b-44ff-50fc-db72-75bfb3246831",
      "description": "Rule-selected execution criterion: the node with the longest backward supported-execution chain.",
      "graph_id": "/Game/LensCorpus/BP_LensCorpus_Main.BP_LensCorpus_Main:EvaluateEncounter",
      "query_id": "M7-Q-S-C02-EXEC",
      "risk_dimensions": [
        "branching_and_incomparable_outcomes"
      ],
      "slice_kind": "execution"
    },
    {
      "annotation_scope": "whole_graph",
      "candidate_id": "M7-C02",
      "description": "Rule-selected data member: the member GUID with the most Set nodes.",
      "graph_id": "/Game/LensCorpus/BP_LensCorpus_Main.BP_LensCorpus_Main:EvaluateEncounter",
      "member_guid": "fb89bbda-4c06-a817-0d9e-13bb96e04595",
      "member_name": "Ready",
      "query_id": "M7-Q-S-C02-DATA",
      "risk_dimensions": [
        "branching_and_incomparable_outcomes"
      ],
      "slice_kind": "data"
    },
    {
      "annotation_scope": "whole_graph",
      "backward_chain_depth": 2,
      "candidate_id": "M7-C03",
      "criterion_node_id": "/Game/LensCorpus/BP_LensCorpus_Main.BP_LensCorpus_Main:ComputeReadiness::node::66938d40-45b4-c96c-9c02-06a66e7d55f4",
      "description": "Rule-selected execution criterion: the node with the longest backward supported-execution chain.",
      "graph_id": "/Game/LensCorpus/BP_LensCorpus_Main.BP_LensCorpus_Main:ComputeReadiness",
      "query_id": "M7-Q-S-C03-EXEC",
      "risk_dimensions": [
        "data_provenance_fan_in_fan_out"
      ],
      "slice_kind": "execution"
    },
    {
      "annotation_scope": "whole_graph",
      "candidate_id": "M7-C03",
      "description": "Rule-selected data member: the member GUID with the most Set nodes.",
      "graph_id": "/Game/LensCorpus/BP_LensCorpus_Main.BP_LensCorpus_Main:ComputeReadiness",
      "member_guid": "663548ed-41d5-a0bc-5de1-769686b34b74",
      "member_name": "MaxCapacity",
      "query_id": "M7-Q-S-C03-DATA",
      "risk_dimensions": [
        "data_provenance_fan_in_fan_out"
      ],
      "slice_kind": "data"
    },
    {
      "annotation_scope": "whole_graph",
      "backward_chain_depth": 1,
      "candidate_id": "M7-C04",
      "criterion_node_id": "/Game/LensCorpus/BP_LensCorpus_Main.BP_LensCorpus_Main:CallService::node::b76d106f-4c35-5194-d976-43b73c9e4b53",
      "description": "Rule-selected execution criterion: the node with the longest backward supported-execution chain.",
      "graph_id": "/Game/LensCorpus/BP_LensCorpus_Main.BP_LensCorpus_Main:CallService",
      "query_id": "M7-Q-S-C04-EXEC",
      "risk_dimensions": [
        "call_and_context"
      ],
      "slice_kind": "execution"
    },
    {
      "annotation_scope": "whole_graph",
      "candidate_id": "M7-C04",
      "description": "Rule-selected data member: the member GUID with the most Set nodes.",
      "graph_id": "/Game/LensCorpus/BP_LensCorpus_Main.BP_LensCorpus_Main:CallService",
      "member_guid": "39422539-451a-9f61-92fd-ac913050f763",
      "member_name": "IsServiceAccepted",
      "query_id": "M7-Q-S-C04-DATA",
      "risk_dimensions": [
        "call_and_context"
      ],
      "slice_kind": "data"
    },
    {
      "annotation_scope": "whole_graph",
      "backward_chain_depth": 1,
      "candidate_id": "M7-C05",
      "criterion_node_id": "/Game/LensCorpus/BP_LC4_AsyncBarrier.BP_LC4_AsyncBarrier:EventGraph::node::4c733898-4c04-882e-f540-f28ebf82fa9a",
      "description": "Rule-selected execution criterion: the node with the longest backward supported-execution chain.",
      "graph_id": "/Game/LensCorpus/BP_LC4_AsyncBarrier.BP_LC4_AsyncBarrier:EventGraph",
      "query_id": "M7-Q-S-C05-EXEC",
      "risk_dimensions": [
        "sequence_async_completion_and_synchronization"
      ],
      "slice_kind": "execution"
    },
    {
      "annotation_scope": "whole_graph",
      "candidate_id": "M7-C05",
      "description": "Rule-selected data member: the member GUID with the most Set nodes.",
      "graph_id": "/Game/LensCorpus/BP_LC4_AsyncBarrier.BP_LC4_AsyncBarrier:EventGraph",
      "member_guid": "13d24cee-4f6f-1497-5f20-fb9c6ef8b9b7",
      "member_name": "LC4AsyncComplete",
      "query_id": "M7-Q-S-C05-DATA",
      "risk_dimensions": [
        "sequence_async_completion_and_synchronization"
      ],
      "slice_kind": "data"
    },
    {
      "annotation_scope": "whole_graph",
      "backward_chain_depth": 6,
      "candidate_id": "M7-C06",
      "criterion_node_id": "/Game/LensCorpus/BP_LC6_BoundaryMatrix.BP_LC6_BoundaryMatrix:EventGraph::node::84290cad-4610-ded7-8c13-9fa6518c66ef",
      "description": "Rule-selected execution criterion: the node with the longest backward supported-execution chain.",
      "graph_id": "/Game/LensCorpus/BP_LC6_BoundaryMatrix.BP_LC6_BoundaryMatrix:EventGraph",
      "query_id": "M7-Q-S-C06-EXEC",
      "risk_dimensions": [
        "opaque_unsupported_and_query_budget_boundaries"
      ],
      "slice_kind": "execution"
    },
    {
      "annotation_scope": "whole_graph",
      "candidate_id": "M7-C06",
      "description": "Rule-selected data member: the member GUID with the most Set nodes.",
      "graph_id": "/Game/LensCorpus/BP_LC6_BoundaryMatrix.BP_LC6_BoundaryMatrix:EventGraph",
      "member_guid": "0068d568-47ad-601c-5cb2-4e9b90fc1266",
      "member_name": "LC6UnsupportedDone",
      "query_id": "M7-Q-S-C06-DATA",
      "risk_dimensions": [
        "opaque_unsupported_and_query_budget_boundaries"
      ],
      "slice_kind": "data"
    },
    {
      "annotation_scope": "whole_graph",
      "backward_chain_depth": 3,
      "candidate_id": "M7-C07",
      "criterion_node_id": "/Game/LensCorpus/BP_LC7_StaticSCC.BP_LC7_StaticSCC:EventGraph::node::c0a8dfab-41b4-77d0-0c2f-19b475bd5dac",
      "description": "Rule-selected execution criterion: the node with the longest backward supported-execution chain.",
      "graph_id": "/Game/LensCorpus/BP_LC7_StaticSCC.BP_LC7_StaticSCC:EventGraph",
      "query_id": "M7-Q-S-C07-EXEC",
      "risk_dimensions": [
        "cycles_and_multiple_sccs"
      ],
      "slice_kind": "execution"
    },
    {
      "annotation_scope": "whole_graph",
      "candidate_id": "M7-C07",
      "description": "Rule-selected data member: the member GUID with the most Set nodes.",
      "graph_id": "/Game/LensCorpus/BP_LC7_StaticSCC.BP_LC7_StaticSCC:EventGraph",
      "member_guid": "f057a73c-4c2c-d664-651c-129321be6a47",
      "member_name": "LC7Counter",
      "query_id": "M7-Q-S-C07-DATA",
      "risk_dimensions": [
        "cycles_and_multiple_sccs"
      ],
      "slice_kind": "data"
    },
    {
      "annotation_scope": "whole_graph",
      "backward_chain_depth": 4,
      "candidate_id": "M7-C08",
      "criterion_node_id": "/Game/LensCorpus/BP_M3_MultiSCCRisk.BP_M3_MultiSCCRisk:EventGraph::node::238c69c9-47ee-b942-5e43-b89cfffe919a",
      "description": "Rule-selected execution criterion: the node with the longest backward supported-execution chain.",
      "graph_id": "/Game/LensCorpus/BP_M3_MultiSCCRisk.BP_M3_MultiSCCRisk:EventGraph",
      "query_id": "M7-Q-S-C08-EXEC",
      "risk_dimensions": [
        "cycles_and_multiple_sccs"
      ],
      "slice_kind": "execution"
    },
    {
      "annotation_scope": "whole_graph",
      "candidate_id": "M7-C08",
      "description": "Rule-selected data member: the member GUID with the most Set nodes.",
      "graph_id": "/Game/LensCorpus/BP_M3_MultiSCCRisk.BP_M3_MultiSCCRisk:EventGraph",
      "member_guid": "0467f668-4810-2a51-e0a3-f98a3b1ee2cc",
      "member_name": "M3DispatchAttempts",
      "query_id": "M7-Q-S-C08-DATA",
      "risk_dimensions": [
        "cycles_and_multiple_sccs"
      ],
      "slice_kind": "data"
    },
    {
      "annotation_scope": "whole_graph",
      "backward_chain_depth": 42,
      "candidate_id": "M7-C09",
      "criterion_node_id": "/Game/M7Corpus/BP_M7_MotifScale.BP_M7_MotifScale:EventGraph::node::0a8b2c5c-4712-f876-e084-878f047bc8ed",
      "description": "Rule-selected execution criterion: the node with the longest backward supported-execution chain.",
      "graph_id": "/Game/M7Corpus/BP_M7_MotifScale.BP_M7_MotifScale:EventGraph",
      "query_id": "M7-Q-S-C09-EXEC",
      "risk_dimensions": [
        "branching_and_incomparable_outcomes",
        "data_provenance_fan_in_fan_out",
        "sequence_async_completion_and_synchronization",
        "call_and_context",
        "opaque_unsupported_and_query_budget_boundaries",